{"$schema":"https://json-schema.org/draft/2020-12/schema","title":"RetrievalEvent","type":"object","required":["retrieval_event_id","source_id","retrieved_at","original_url","hash_algorithm","content_hash","version"],"properties":{"retrieval_event_id":{"type":"string"},"source_id":{"type":"string"},"retrieved_at":{"type":"string","format":"date-time"},"original_url":{"type":["string","null"],"format":"uri"},"canonical_url":{"type":["string","null"],"format":"uri"},"archive_url":{"type":["string","null"],"format":"uri"},"archive_captured_at":{"type":["string","null"],"format":"date-time"},"artifact_media_type":{"type":["string","null"]},"artifact_identifier":{"type":["string","null"]},"hash_algorithm":{"enum":["sha256","sha512"]},"content_hash":{"type":"string","minLength":32},"http_etag":{"type":["string","null"]},"http_last_modified":{"type":["string","null"]},"notes":{"type":"string"},"version":{"type":"integer","minimum":1},"previous_version_id":{"type":["string","null"]}}}