[
  {
    "retrieval_event_id": "RET-G3-NBS-CPI-2026-07",
    "source_id": "SRC-G3-NBS-CPI-2026-07",
    "retrieved_at": "2026-08-30T00:00:00Z",
    "original_url": "https://microdata.nigerianstat.gov.ng/index.php/catalog/154/download/1432",
    "canonical_url": "https://microdata.nigerianstat.gov.ng/index.php/catalog/154/download/1432",
    "archive_url": null,
    "archive_captured_at": null,
    "artifact_media_type": "application/zip",
    "artifact_identifier": "NBS July 2026 CPI Report compressed ZIP; catalog download 1432",
    "hash_algorithm": "sha256",
    "content_hash": "8c6fcf05cdaf1e847e77f27cdd5a68b58cc7ae2668061e018778b1accedd6ed9",
    "http_etag": null,
    "http_last_modified": null,
    "notes": "Hash is for the canonical captured representation recorded in the source fixture, not a claim of remote-byte hashing.",
    "version": 1,
    "previous_version_id": null
  },
  {
    "retrieval_event_id": "RET-G3-NBS-CPI-DATASET",
    "source_id": "SRC-G3-NBS-CPI-DATASET",
    "retrieved_at": "2026-08-30T00:00:00Z",
    "original_url": "https://microdata.nigerianstat.gov.ng/index.php/catalog/154",
    "canonical_url": "https://microdata.nigerianstat.gov.ng/index.php/catalog/154",
    "archive_url": null,
    "archive_captured_at": null,
    "artifact_media_type": "text/html",
    "artifact_identifier": "NGA-NBS-CPI catalog entry",
    "hash_algorithm": "sha256",
    "content_hash": "6a18676518e4e025f0bd0a63494e4000630a37d93d92c61373a4502aa8259f82",
    "http_etag": null,
    "http_last_modified": null,
    "notes": "Hash is for the canonical captured representation recorded in the source fixture.",
    "version": 1,
    "previous_version_id": null
  },
  {
    "retrieval_event_id": "RET-G3-REUTERS-COL-2026-08-10",
    "source_id": "SRC-G3-REUTERS-COL-2026-08-10",
    "retrieved_at": "2026-08-30T00:00:00Z",
    "original_url": "https://www.reuters.com/world/africa/nigerians-cost-living-pain-deepens-election-looms-2026-08-10/",
    "canonical_url": "https://www.reuters.com/world/africa/nigerians-cost-living-pain-deepens-election-looms-2026-08-10/",
    "archive_url": null,
    "archive_captured_at": null,
    "artifact_media_type": "text/html",
    "artifact_identifier": "Reuters article retrieved for controlled ingestion",
    "hash_algorithm": "sha256",
    "content_hash": "6f384303bd8b3414f3a2407d4ae13c934cc62e280d918027d729e86add38eb27",
    "http_etag": null,
    "http_last_modified": null,
    "notes": "Hash is for the canonical captured representation recorded in the source fixture.",
    "version": 1,
    "previous_version_id": null
  },
  {
    "retrieval_event_id": "RET-G3-PROSHARE-X-2026-03-24",
    "source_id": "SRC-G3-PROSHARE-X-2026-03-24",
    "retrieved_at": "2026-08-30T00:00:00Z",
    "original_url": "https://x.com/proshare/status/2036376803762176328",
    "canonical_url": "https://x.com/proshare/status/2036376803762176328",
    "archive_url": null,
    "archive_captured_at": null,
    "artifact_media_type": "text/html",
    "artifact_identifier": "X status 2036376803762176328",
    "hash_algorithm": "sha256",
    "content_hash": "b2065f7be243942c18e2d545dbbff83f3a781352abab35dddef9a279d39b7611",
    "http_etag": null,
    "http_last_modified": null,
    "notes": "The X artifact is represented by a canonical captured text record. The source record does not equate account authorship with truth of the post's propositions.",
    "version": 1,
    "previous_version_id": null
  },
  {
    "retrieval_event_id": "RET-G3-CBN-HOMEPAGE-SNAPSHOT",
    "source_id": "SRC-G3-CBN-HOMEPAGE-SNAPSHOT",
    "retrieved_at": "2026-08-30T00:00:00Z",
    "original_url": "https://www.cbn.gov.ng/",
    "canonical_url": "https://www.cbn.gov.ng/",
    "archive_url": null,
    "archive_captured_at": null,
    "artifact_media_type": "text/html",
    "artifact_identifier": "CBN homepage indicator snapshot inspected 2026-08-30",
    "hash_algorithm": "sha256",
    "content_hash": "d62928e1467634c74eff961eb82aafc14dd1fdb3734cc7884fc31a9bb00cd3fc",
    "http_etag": null,
    "http_last_modified": null,
    "notes": "The homepage value is stored as a dated observation of what the page displayed at retrieval, not as an undated timeless fact.",
    "version": 1,
    "previous_version_id": null
  }
]
